{"admissionId":"local-k3s-gpu-runtime-v1","collectedAt":null,"gates":[{"evidence":[],"gate":"native_ubuntu_host","status":"pending"},{"evidence":[],"gate":"container_gpu_identity","status":"pending"},{"evidence":[],"gate":"scheduled_pod_gpu_identity","status":"pending"},{"evidence":[],"gate":"node_gpu_policy","status":"pending"},{"evidence":[],"gate":"bounded_scheduling_guards","status":"pending"},{"evidence":[],"gate":"idle_and_smoke_limits","status":"pending"}],"infrastructureRevision":"${INFRASTRUCTURE_REVISION}","limitations":["Pending execution on the declared native-Ubuntu single-node k3s workstation.","This template contains no RTX 3080, GPU, Kubernetes, or production capability evidence.","macOS and hosted CI may validate contracts only; they are not admitted target runtimes."],"observations":{},"schemaVersion":"v1","status":"pending","synthetic":false,"target":{"architecture":"amd64","gpuCount":1,"gpuModel":"NVIDIA GeForce RTX 3080","nodeCount":1,"operatingSystem":"Ubuntu","runtime":"native"}}
